{
  "format_version": "1.0",
  "instance_id": "tiny-single-rotatable",
  "placements": [
    {
      "box_id": "panel-01",
      "orientation": "WLH",
      "position": {
        "x": 0,
        "y": 0,
        "z": 0
      },
      "dimensions": {
        "length": 3,
        "width": 2,
        "height": 1
      }
    }
  ],
  "metrics": {
    "packed_volume": 6,
    "utilization": 0.25
  }
}
